{
	"$schema": "./prd.schema.json",
	"meta": {
		"project": "gmp-tui-go",
		"version": "0.1.0-dev",
		"generated": "2026-05-11T16:36:20Z",
		"owner": "fpcmotif@gmail.com",
		"fork_of": "can1357/oh-my-pi",
		"tui_fork_of": "charmbracelet/crush",
		"tui_fork_release": "v0.65.3",
		"tui_fork_sha": "3aa26d99627b3faa6a2535f19ad8b1e7bcdff545",
		"tui_fork_commit_in_repo": "752c515c5",
		"bridge_commit": "331ebcff6",
		"bridge_branch": "codex/tui-go-crush-rpc",
		"bridge_worktree": ".wt/tui-go-crush-rpc",
		"agent_protocol": "omp --mode rpc",
		"binary": "gmp-tui-go",
		"binary_previous": "omp-tui-go",
		"module_path": "github.com/fpcMotif/gosh-my-pi/apps/tui-go",
		"module_path_previous": "github.com/charmbracelet/crush",
		"module_path_rewrite": "done in P5 (T-P5-000a)",
		"license_boundary": {
			"apps/tui-go/": "FSL-1.1-MIT",
			"default": "MIT"
		},
		"plan_doc": "/Users/martinfan/.claude/plans/dd-an-apps-tui-go-2-wondrous-cookie.md"
	},
	"progress_summary": {
		"timestamp": "2026-05-11T16:36:20Z",
		"confidence": "static-artifact high; runtime not claimed",
		"confidence_note": "Audited docs/adr/*.md, apps/tui-go/prd.json, apps/tui-go/prd.schema.json, and implementation evidence with rg/sed. This board is now schema-valid and aligned to the files checked. Runtime 100% confidence still needs focused test runs and smoke tests, which were not run because repo instructions require explicit test instruction.",
		"checked_evidence": [
			"docs/adr/0001-gmp-mode-credential-store.md",
			"docs/adr/0002-apps-tui-go-gmp-only.md",
			"docs/adr/0003-agent-recovery-policy-not-workflow.md",
			"docs/adr/0004-provider-abort-taxonomy-effect-race-not-tracker.md",
			"apps/tui-go/internal/cmd/root.go",
			"apps/tui-go/internal/cmd/login.go",
			"apps/tui-go/internal/cmd/run.go",
			"apps/tui-go/internal/workspace/gmp_workspace.go",
			"apps/tui-go/internal/workspace/workspace.go",
			"packages/coding-agent/src/modes/rpc/rpc-mode.ts",
			"packages/coding-agent/src/modes/rpc/rpc-mode-auth-picker.test.ts",
			"packages/coding-agent/src/session/recovery-policy.ts",
			"packages/coding-agent/src/session/run-bridge.ts",
			"packages/agent/src/run/agent-run.ts",
			"packages/agent/src/run/recovery-marker.ts",
			"packages/agent/src/errors.ts",
			"packages/ai/src/providers/openai-responses.ts",
			"packages/ai/src/providers/openai-completions.ts"
		],
		"missing_runtime_evidence": [
			"Go login contract test file named in ADR 0002 is not present in the current checkout",
			"No focused Go or Bun tests were run during this PRD audit",
			"P8 end-to-end smoke and release dry-run remain unrun"
		]
	},
	"top_priorities": [
		{
			"rank": 1,
			"title": "Close ADR 0002 auth/login consumer-side contract gap",
			"state": "pending",
			"why": "ADR 0002 explicitly calls for apps/tui-go/internal/cmd/login_test.go, but that file is absent. Backend picker tests exist, so the remaining confidence gap is the Go CLI consumer contract.",
			"adr_refs": ["ADR-0002"],
			"next_tasks": ["T-P6-007", "T-P6-008"]
		},
		{
			"rank": 2,
			"title": "Resolve the TS-TUI removal mismatch",
			"state": "pending",
			"why": "The prior P6a done note conflicts with the current tree: InteractiveMode, modes/components, packages/tui, and @oh-my-pi/pi-tui references are still present. The board must not claim this is done until the code matches.",
			"adr_refs": ["ADR-0002"],
			"next_tasks": ["T-P6-001", "T-P6-002", "T-P6-003", "T-P6-004", "T-P6-005", "T-P6-006"]
		},
		{
			"rank": 3,
			"title": "Implement ADR 0004 provider abort migration",
			"state": "pending",
			"why": "LocalAbort and Effect signal helpers exist, but openai-responses.ts and openai-completions.ts still import createAbortSourceTracker. ADR 0004 remains Proposed until the provider boundary moves to Effect.race.",
			"adr_refs": ["ADR-0004"],
			"next_tasks": ["T-P10-001", "T-P10-002"]
		}
	],
	"adr_alignment": [
		{
			"id": "ADR-0001",
			"status": "Accepted — 2026-05-07",
			"state": "done",
			"decision": "In gmp mode, backend model catalog/AuthStorage is the source of truth; Crush local provider stores are inert at runtime.",
			"evidence": [
				"apps/tui-go/internal/workspace/gmp_workspace.go implements IsGmpMode() = true and auth/model bridge code",
				"apps/tui-go/internal/ui/model/ui.go routes auth through runGmpAuthCommand",
				"apps/tui-go/internal/cmd/login.go drives auth.login over the gmp RPC subprocess and documents AuthStorage ownership",
				"packages/coding-agent/src/modes/rpc/rpc-mode.ts exposes models.catalog, set_model, and auth.login handling"
			],
			"gaps": ["Runtime auth smoke was not re-run in this audit"],
			"next_actions": [
				"Keep ADR 0001 as the accepted source of truth for auth/model ownership",
				"Use P8 smoke test to prove the path end-to-end before release"
			]
		},
		{
			"id": "ADR-0002",
			"status": "Accepted — 2026-05-07",
			"state": "in_progress",
			"decision": "apps/tui-go is gmp-only; empty auth.login provider triggers a backend-driven auth.pick_provider flow; Phase 1 lite removes unreachable vanilla Crush workspace paths.",
			"evidence": [
				"apps/tui-go/internal/cmd/root.go setupWorkspace returns setupGmpWorkspace only",
				"app_workspace.go and client_workspace.go are absent from apps/tui-go/internal/workspace",
				"apps/tui-go/internal/cmd/run.go now dispatches non-interactive prompts to the gmp RPC backend",
				"packages/coding-agent/src/modes/rpc/rpc-mode-auth-picker.test.ts covers empty provider picker, cancellation, malformed reply, and defaultId wire shape",
				"apps/tui-go/internal/ui/model/ui_test.go covers openAuthenticationDialog dispatching through SendAuthCommand"
			],
			"gaps": [
				"ADR-named apps/tui-go/internal/cmd/login_test.go is absent",
				"apps/tui-go/internal/workspace/workspace.go still has comments naming AppWorkspace and ClientWorkspace false branches",
				"apps/tui-go/.goreleaser.yml is still tracked and P7 marks deletion pending"
			],
			"next_actions": [
				"Add Go CLI auth.login picker contract tests for runGmpLogin/authCLIDriver",
				"Refresh stale workspace comments now that apps/tui-go is gmp-only",
				"Delete or neutralize apps/tui-go/.goreleaser.yml before release work"
			]
		},
		{
			"id": "ADR-0003",
			"status": "Accepted — 2026-05-07",
			"state": "in_progress",
			"decision": "Agent recovery is a RecoveryPolicy over the existing session JSONL, using recovery-marker lines and never replaying side-effecting tools.",
			"evidence": [
				"packages/agent/src/run/recovery-marker.ts defines RecoveryMarker and recovery-marker payloads",
				"packages/agent/src/run/agent-run.ts defines AgentRunController without replacing RetryController",
				"packages/coding-agent/src/session/recovery-policy.ts classifies safe, mid-stream, and mid-tool states and documents the never-re-run rule",
				"packages/coding-agent/src/session/recovery-driver.ts applies classified recovery",
				"packages/coding-agent/src/session/run-bridge.ts gates the runtime path behind OMP_RECOVERY_POLICY=1"
			],
			"gaps": [
				"The runtime path is still env-gated, so default production adoption is not proven by this audit",
				"No focused recovery-policy or agent-run tests were run during this PRD audit"
			],
			"next_actions": [
				"Decide whether OMP_RECOVERY_POLICY remains gated or becomes default-on",
				"Run focused recovery-policy, recovery-driver, run-bridge, and agent-run tests when test execution is explicitly requested"
			]
		},
		{
			"id": "ADR-0004",
			"status": "Proposed — 2026-05-08",
			"state": "pending",
			"decision": "Provider abort taxonomy should move from AbortSourceTracker to Effect.race with LocalAbort for provider-local timeout/idle/stall failures.",
			"evidence": [
				"packages/agent/src/errors.ts defines LocalAbort",
				"packages/agent/src/error-kind.ts maps LocalAbort into transient transport",
				"packages/utils/src/effect-signal.ts defines effectFromSignal and signalFromFiber"
			],
			"gaps": [
				"packages/ai/src/utils/abort.ts still defines createAbortSourceTracker",
				"packages/ai/src/providers/openai-responses.ts still imports and uses createAbortSourceTracker",
				"packages/ai/src/providers/openai-completions.ts still imports and uses createAbortSourceTracker",
				"ADR 0004 is not yet included in packages/coding-agent/src/internal-urls/docs-index.generated.ts"
			],
			"next_actions": [
				"Migrate OpenAI provider streaming boundaries to Effect.race + LocalAbort",
				"Delete createAbortSourceTracker and update remaining consumers in the same PR",
				"Promote ADR 0004 status after migration lands"
			]
		}
	],
	"phases": [
		{
			"id": "P0",
			"name": "Fork import",
			"state": "done",
			"evidence": "subtree commit 752c515c5 imports Crush v0.65.3"
		},
		{
			"id": "P1",
			"name": "Module + toolchain",
			"state": "done",
			"evidence": "Module rewritten in P5 (T-P5-000a) across 198 Go files + go.mod; go 1.26.2 inherited from Crush"
		},
		{
			"id": "P2",
			"name": "Strip subsystems",
			"state": "deferred",
			"notes": "lsp/db/agent/server/oauth/skills retained; bridge bypasses them; revisit V2"
		},
		{
			"id": "P3",
			"name": "RPC client (ompclient)",
			"state": "done",
			"evidence": "internal/ompclient — 547 LOC; Spawn/Call/Send/Close + fan-out channels"
		},
		{
			"id": "P4",
			"name": "Workspace transplant (omp_workspace)",
			"state": "done",
			"evidence": "internal/workspace/omp_workspace.go — 1379 LOC; contract test passes"
		},
		{
			"id": "P5",
			"name": "Polish: rename binary + module rewrite + license notice + slash + status + min-size + logging",
			"state": "done",
			"evidence": "module rewrite, binary rename, NOTICE/CONTRIBUTING/prd.json placed, sibling+--agent-cmd lookup, ~/.gmp/tui.log + --debug stderr, 60x10 banner, /quit /help /clear /debug local traps, R3 fixture skipped, root README license boundary added; go build + vet + go test ./... all green",
			"acceptance_criteria": [
				"Binary renamed: omp-tui-go → gmp-tui-go (DONE)",